{
  "$schema": "https://json-schema.org/draft/2020-12/schema",
  "title": "PCS analysis report v1",
  "type": "object",
  "additionalProperties": false,
  "properties": {
    "schema_version": {
      "const": "1.0"
    },
    "scope_id": {
      "type": "string",
      "minLength": 1
    },
    "summary": {
      "type": "string",
      "minLength": 1
    },
    "assumptions": {
      "type": "array",
      "items": {
        "type": "string",
        "minLength": 1
      }
    },
    "gaps": {
      "type": "array",
      "items": {
        "type": "string",
        "minLength": 1
      }
    },
    "evidence": {
      "type": "array",
      "items": {
        "type": "object",
        "additionalProperties": false,
        "properties": {
          "evidence_id": {
            "type": "string",
            "minLength": 1
          },
          "source": {
            "type": "string",
            "minLength": 1
          },
          "locator": {
            "type": "string",
            "minLength": 1
          },
          "observed_at": {
            "type": [
              "string",
              "null"
            ]
          },
          "collected_at": {
            "type": "string",
            "minLength": 1
          },
          "grade": {
            "enum": [
              "A",
              "B",
              "C",
              "D"
            ]
          },
          "claim_type": {
            "enum": [
              "observed",
              "source_claim",
              "inference",
              "hypothesis",
              "forecast"
            ]
          },
          "claim": {
            "type": "string",
            "minLength": 1
          }
        },
        "required": [
          "evidence_id",
          "source",
          "locator",
          "observed_at",
          "collected_at",
          "grade",
          "claim_type",
          "claim"
        ]
      }
    },
    "findings": {
      "type": "array",
      "items": {
        "type": "object",
        "additionalProperties": false,
        "properties": {
          "finding_id": {
            "type": "string",
            "minLength": 1
          },
          "asset_ids": {
            "type": "array",
            "items": {
              "type": "string",
              "minLength": 1
            },
            "uniqueItems": true
          },
          "hypothesis": {
            "type": "string",
            "minLength": 1
          },
          "evidence_ids": {
            "type": "array",
            "items": {
              "type": "string",
              "minLength": 1
            },
            "uniqueItems": true
          },
          "priority": {
            "enum": [
              "urgent_verification",
              "high",
              "medium",
              "low"
            ]
          },
          "priority_reason": {
            "type": "string",
            "minLength": 1
          },
          "residual_risk": {
            "type": "string",
            "minLength": 1
          },
          "status": {
            "enum": [
              "hypothesis",
              "confirmed",
              "proposed",
              "implemented",
              "validated"
            ]
          },
          "validation": {
            "type": "object",
            "additionalProperties": false,
            "properties": {
              "status": {
                "enum": [
                  "not_run",
                  "planned",
                  "passed",
                  "failed",
                  "inconclusive"
                ]
              },
              "method": {
                "type": "string",
                "minLength": 1
              },
              "evidence_ids": {
                "type": "array",
                "items": {
                  "type": "string",
                  "minLength": 1
                },
                "uniqueItems": true
              },
              "limitations": {
                "type": "array",
                "items": {
                  "type": "string",
                  "minLength": 1
                }
              }
            },
            "required": [
              "status",
              "method",
              "evidence_ids",
              "limitations"
            ]
          },
          "actions": {
            "type": "array",
            "items": {
              "type": "object",
              "additionalProperties": false,
              "properties": {
                "action_id": {
                  "type": "string",
                  "minLength": 1
                },
                "effect": {
                  "enum": [
                    "Deny",
                    "Disrupt",
                    "Deceive"
                  ]
                },
                "proposal": {
                  "type": "string",
                  "minLength": 1
                },
                "owner": {
                  "type": [
                    "string",
                    "null"
                  ]
                },
                "due_at": {
                  "type": [
                    "string",
                    "null"
                  ]
                },
                "approval_required": {
                  "type": "boolean"
                },
                "business_impact": {
                  "type": "string",
                  "minLength": 1
                },
                "rollback": {
                  "type": "string",
                  "minLength": 1
                }
              },
              "required": [
                "action_id",
                "effect",
                "proposal",
                "owner",
                "due_at",
                "approval_required",
                "business_impact",
                "rollback"
              ]
            }
          }
        },
        "required": [
          "finding_id",
          "asset_ids",
          "hypothesis",
          "evidence_ids",
          "priority",
          "priority_reason",
          "residual_risk",
          "status",
          "validation",
          "actions"
        ]
      }
    },
    "metrics": {
      "type": "array",
      "items": {
        "type": "object",
        "additionalProperties": false,
        "properties": {
          "name": {
            "type": "string",
            "minLength": 1
          },
          "value": {
            "type": [
              "number",
              "null"
            ]
          },
          "numerator": {
            "type": [
              "number",
              "null"
            ]
          },
          "denominator": {
            "type": [
              "number",
              "null"
            ]
          },
          "limitation": {
            "type": "string",
            "minLength": 1
          }
        },
        "required": [
          "name",
          "value",
          "numerator",
          "denominator",
          "limitation"
        ]
      }
    },
    "limitations": {
      "type": "array",
      "items": {
        "type": "string",
        "minLength": 1
      }
    }
  },
  "required": [
    "schema_version",
    "scope_id",
    "summary",
    "assumptions",
    "gaps",
    "evidence",
    "findings",
    "metrics",
    "limitations"
  ]
}
